[
 {
  "id": "abominable",
  "name": "Abominable",
  "dlc": "base",
  "source": "Abominable",
  "form_id": "0015eadb",
  "description": "There's nothing abominable about your damage bonus against [[Fallout: New Vegas creatures",
  "ranks": 3,
  "requirements": {
   "other": "Kill 50 abominations"
  },
  "requires_text": "Kill 50 abominations",
  "effects_text": "Increased weapon damage against abominations (3/6/10%)."
 },
 {
  "id": "action_boy_action_girl",
  "name": "Action Boy Action Girl",
  "dlc": "base",
  "source": "Action Boy Action Girl (Fallout: New Vegas)",
  "form_id": "00031dba",
  "description": "With the Action Boy/Action Girl perk, you gain an additional 15 Action Points to use in V.A.T.S.",
  "ranks": 2,
  "requirements": {
   "level": 16,
   "special": {
    "agility": 6
   }
  },
  "requires_text": "Level 16; Agility 6",
  "effects_text": "+15/30 Action Points",
  "modifiers": [
   {
    "type": "action_points",
    "amount": 15
   }
  ]
 },
 {
  "id": "adamantium_skeleton",
  "name": "Adamantium Skeleton",
  "dlc": "base",
  "source": "Adamantium Skeleton (Fallout: New Vegas)",
  "form_id": "00094ec4",
  "description": "With the Adamantium Skeleton perk, your limbs only receive 50% of the damage they normally would.",
  "ranks": 1,
  "requirements": {
   "level": 14
  },
  "requires_text": "Level 14",
  "effects_text": "50% reduced limb damage"
 },
 {
  "id": "agility_implant",
  "name": "Agility Implant",
  "dlc": "base",
  "source": "Agility Implant",
  "form_id": "0014c12a",
  "description": "Your central nervous node has been enhanced with the Reflex Booster, increasing your Agility by 1.",
  "ranks": 1,
  "requirements": {
   "other": "4000 caps (3000 if Agility < 4)"
  },
  "requires_text": "4000 caps (3000 if Agility < 4)",
  "effects_text": "+1 to Agility"
 },
 {
  "id": "ain_t_like_that_now",
  "name": "Ain't Like That Now",
  "dlc": "lonesome_road",
  "source": "Ain't Like That Now",
  "description": "Maybe you were bad once, but you ain't like that now. Your [[Karma (Fallout: New Vegas)",
  "ranks": 1,
  "requirements": {
   "level": 50,
   "other": "Evil or Very Evil Karma"
  },
  "requires_text": "Level 50; Evil or Very Evil Karma",
  "effects_text": "25% faster AP regeneration; 20% attack speed increase; Karma reset to 0; Immunity to critical hits"
 },
 {
  "id": "alertness",
  "name": "Alertness",
  "dlc": "lonesome_road",
  "source": "Alertness",
  "description": "You've learned to keep your senses alert to any danger. When crouched and not moving you gain a +2 to your Perception attribute to help you find enemies before they find you.",
  "ranks": 1,
  "requirements": {
   "level": 12,
   "other": "PER > 6 PER < 10"
  },
  "requires_text": "Level 12; PER > 6; PER < 10",
  "effects_text": "While crouched and motionless, you gain +2 Perception."
 },
 {
  "id": "and_stay_back",
  "name": "And Stay Back",
  "dlc": "dead_money",
  "source": "And Stay Back",
  "description": "You've discovered a Shotgun technique that has a chance to knock an enemy back.",
  "ranks": 1,
  "requirements": {
   "level": 10,
   "skills": {
    "guns": 70
   }
  },
  "requires_text": "Level 10; Guns 70",
  "effects_text": "Chance to knock an enemy back while using a shotgun"
 },
 {
  "id": "animal_control",
  "name": "Animal Control",
  "dlc": "base",
  "source": "Animal Control (perk)",
  "form_id": "0015eae0",
  "description": "You handle animals really well when they are dead and gain a damage bonus against the living ones.",
  "ranks": 3,
  "requirements": {
   "other": "Kill 50/100/150 mutated animals"
  },
  "requires_text": "Kill 50/100/150 mutated animals",
  "effects_text": "3/6/10% increased damage against mutated animals"
 },
 {
  "id": "animal_friend",
  "name": "Animal Friend",
  "dlc": "base",
  "source": "Animal Friend (Fallout: New Vegas)",
  "form_id": "00031db5",
  "description": "At the first rank of this perk, animals simply won't attack. At the second rank, they will actually come to your aid in combat, but never against another animal.",
  "ranks": 2,
  "requirements": {
   "level": 10,
   "special": {
    "charisma": 6
   },
   "skills": {
    "survival": 45
   }
  },
  "requires_text": "Level 10; Charisma 6; Survival 45",
  "effects_text": "Rank 1: Certain animals stay neutral; Rank 2: They assist in combat, but not against other animals"
 },
 {
  "id": "atomic",
  "name": "Atomic!",
  "dlc": "old_world_blues",
  "source": "Atomic!",
  "description": "With the Atomic! perk, you are 25% faster and stronger whenever you're basking in the warm glow of radiation. Outside irradiated areas, your Action Points (AP) regenerate faster and faster the higher your level of radiation sickness becomes.",
  "ranks": 1,
  "requirements": {
   "level": 20,
   "special": {
    "endurance": 6
   }
  },
  "requires_text": "Level 20; Endurance 6",
  "effects_text": "Run speed and attack speed x1.25, +2 STR, +2 DT while being irradiated, bonus to AP regeneration with Rad Poisoning"
 },
 {
  "id": "beautiful_beatdown",
  "name": "Beautiful Beatdown",
  "dlc": "base",
  "source": "Beautiful Beatdown",
  "form_id": "0015eadf",
  "description": "Reduce the AP Cost of Unarmed Attacks in VATS.",
  "ranks": 1,
  "requirements": {
   "other": "Inflict 10 000 damage with unarmed weapons."
  },
  "requires_text": "Inflict 10,000 damage with unarmed weapons.",
  "effects_text": "Reduced AP cost for unarmed attacks."
 },
 {
  "id": "better_criticals",
  "name": "Better Criticals",
  "dlc": "base",
  "source": "Better Criticals (Fallout: New Vegas)",
  "form_id": "00031dbb",
  "description": "With the Better Criticals perk, you gain a 50% damage bonus every time a critical hit is scored on an opponent.",
  "ranks": 1,
  "requirements": {
   "level": 16,
   "special": {
    "perception": 6,
    "luck": 6
   }
  },
  "requires_text": "Level 16; Perception 6; Luck 6",
  "effects_text": "+50% Damage with critical hits"
 },
 {
  "id": "better_healing",
  "name": "Better Healing",
  "dlc": "base",
  "source": "Better Healing",
  "form_id": "0015c60b",
  "description": "While Arcade is a companion, the player regains more health from all sources.",
  "ranks": 1,
  "requirements": {
   "other": "Arcade Gannon as companion"
  },
  "requires_text": "Arcade Gannon as companion",
  "effects_text": "All consumables regain 20% more health."
 },
 {
  "id": "big_brained",
  "name": "Big Brained",
  "dlc": "old_world_blues",
  "source": "Big Brained",
  "description": "Your brain is back in your body, but some of the advanced technologies remain: Your head still cannot be crippled, but you are only 10% more resistant to addiction now. Surprisingly your Damage Threshold has improved by 10% (minimum +1 DT)",
  "ranks": 1,
  "requirements": {
   "other": "Brainless perk"
  },
  "requires_text": "Brainless perk",
  "effects_text": "Head cannot be crippled; +10% DT; +10% chem addiction resistance"
 },
 {
  "id": "black_widow",
  "name": "Black Widow",
  "dlc": "base",
  "source": "Black Widow (Fallout: New Vegas)",
  "form_id": "00094eb8",
  "description": "In combat, you do +10% damage against male opponents. Outside of combat, you'll sometimes have access to unique dialogue options when dealing with the opposite sex.",
  "ranks": 1,
  "requirements": {
   "level": 2,
   "other": "Female character"
  },
  "requires_text": "Level 2; Female character",
  "effects_text": "+10% damage against male opponents; Additional dialogue options with certain male characters"
 },
 {
  "id": "blood_of_the_legion",
  "name": "Blood of the Legion",
  "dlc": "base",
  "source": "Blood of the Legion",
  "form_id": "0017b790",
  "ranks": 1,
  "requirements": {
   "other": "Transplant Lupa's brain into Rex"
  },
  "requires_text": "Transplant Lupa's brain into Rex",
  "effects_text": "+10 Damage Threshold for Rex"
 },
 {
  "id": "bloody_mess",
  "name": "Bloody Mess",
  "dlc": "base",
  "source": "Bloody Mess (Fallout: New Vegas)",
  "form_id": "00094eba",
  "description": "With the Bloody Mess perk, characters and creatures you kill will often explode into a red, gut-ridden, eyeball-strewn paste. Fun! Oh, and you'll do 5% more damage with all weapons.",
  "ranks": 1,
  "requirements": {
   "level": 6
  },
  "requires_text": "Level 6",
  "effects_text": "+5% Damage with all weapons; Enemies can explode upon death"
 },
 {
  "id": "bonds_of_steel",
  "name": "Bonds of Steel",
  "dlc": "base",
  "source": "Bonds of Steel",
  "form_id": "0017714e",
  "ranks": 1,
  "requirements": {
   "other": "Complete I Could Make You Care with Veronica staying with the Brotherhood"
  },
  "requires_text": "Complete I Could Make You Care with Veronica staying with the Brotherhood",
  "effects_text": "+4 DT to Veronica"
 },
 {
  "id": "brainless",
  "name": "Brainless",
  "dlc": "old_world_blues",
  "source": "Brainless",
  "description": "Your brain has been replaced with advanced technologies: Your head can no longer be crippled and is resistant to chem addiction (+25% resistance) and shock from bodily damage (+5% Damage Threshold, minimum +1).",
  "ranks": 1,
  "requirements": {
   "other": "Initial dialogue with Doctor Klein"
  },
  "requires_text": "Initial dialogue with Doctor Klein",
  "effects_text": "Head cannot be crippled; +1 (5%) DT; +25% chem addiction resistance"
 },
 {
  "id": "broad_daylight",
  "name": "Broad Daylight",
  "dlc": "lonesome_road",
  "source": "Broad Daylight",
  "description": "You're so sneaky that you can sneak even with your Pip-Boy light on! Any time the Pip-Boy light is on, you gain a sneak bonus to offset the light's sneak penalty.",
  "ranks": 1,
  "requirements": {
   "level": 36
  },
  "requires_text": "Level 36",
  "effects_text": "Adds 15 points to sneak when the Pip-Boy 3000's light is on."
 },
 {
  "id": "bug_stomper",
  "name": "Bug Stomper",
  "dlc": "base",
  "source": "Bug Stomper",
  "form_id": "0015ead7",
  "description": "Pulling the legs off ants suits you well. You gain a damage bonus against insects.",
  "ranks": 3,